{
  "artifacts": {
    "controller_config_sha256": "4e509fa63fda52e38d21d9f1924b7c0d6bf9dfd1c2d9b94450b7f6e7ca281329",
    "controller_manifest_sha256": "b4ab25535677487866f49daf84215bdb1092177c83924c99e14744287e750331",
    "course_sha256": "85fb17a51d6a53e0ebbb6b298054772ce4043c5f21c6bb216772356983cbf78b",
    "model_tree_sha256": "12c7d68fabc0f24e7ce5ed46697cc41ccdce41eebe464b87201179a3b0a0136a",
    "model_xml_sha256": "2bee8abddbf4bc093bcdb2266c7139cd1c78e279bf65f7ee9fde41fe599900d4",
    "policy_sha256": "44a0fbceb81f3877833ae9a398d039bea1759cb0d3c8188181013885f70589eb",
    "reset_profile_sha256": "0e3013f153ffb542eef55375f80455257e4461969c265a7d32ee49420e104d85",
    "robot_manifest_sha256": "ef33659f5880f2fc4d57f6f7c9fea9efdeb28b35023e4eceaaa9ba0870c52e83",
    "scene_sha256": "88ffcccad2c5df71a7472b4b30ec7e4ea06e045efc6b4e11ccd8bebc2848f0b3",
    "source_commit": "276801e46c5d433564f24658bac64f254b7d2d4b"
  },
  "basic_matrix": {
    "case_count": 20,
    "cases": [
      {
        "collisions": null,
        "course": "BASIC-001@1.0.0",
        "deterministic": true,
        "digest": "e2711c1c8ee4ae26ed49898d021fc04094b55ec72e407c6c1bd8a5453d4bc6ca",
        "energy_joules": 455.2865569485172,
        "episode_passed": true,
        "falls": 0,
        "peak_torque_nm": 93.86233194392503,
        "progress_meters": -0.7586206477975082,
        "reason": "complete",
        "repeat_digest": "e2711c1c8ee4ae26ed49898d021fc04094b55ec72e407c6c1bd8a5453d4bc6ca",
        "reset_perturbation": {
          "base_xy_m": [
            0.0005478467492858173,
            -0.0009208531449445187
          ],
          "base_yaw_rad": -0.0045902647606380536,
          "joint_position_rad": [
            -0.0019338894578858836,
            0.0012530809568010897,
            0.0016510223091108869,
            0.00042654310306871945,
            0.0009179862439359937,
            0.0001744999658616915,
            0.0017402896951510729,
            0.0012634142164861287,
            -0.0019890459993194077,
            0.0014296171063502773
          ]
        },
        "seed": 0,
        "status": "PASS",
        "time_seconds": 10.000000000000009
      },
      {
        "collisions": null,
        "course": "BASIC-001@1.0.0",
        "deterministic": true,
        "digest": "20cb20d098649a3d8fef289df33aa920ab73a4bab5821dd806184fc94ff6db8b",
        "energy_joules": 456.5864512336642,
        "episode_passed": true,
        "falls": 0,
        "peak_torque_nm": 94.3906770160068,
        "progress_meters": -0.7563086848099915,
        "reason": "complete",
        "repeat_digest": "20cb20d098649a3d8fef289df33aa920ab73a4bab5821dd806184fc94ff6db8b",
        "reset_perturbation": {
          "base_xy_m": [
            4.7286498801026864e-05,
            0.0018018547853037412
          ],
          "base_yaw_rad": -0.0035584038728036626,
          "joint_position_rad": [
            0.0017945977885489755,
            -0.0007526741919580582,
            -0.0003066942041096974,
            0.001310810375281767,
            -0.0003632034545233549,
            0.000198374750692238,
            -0.0018897635470277265,
            0.0010140524346992264,
            0.0001525732528771129,
            -0.0006810731340036314
          ]
        },
        "seed": 1,
        "status": "PASS",
        "time_seconds": 10.000000000000009
      },
      {
        "collisions": null,
        "course": "BASIC-001@1.0.0",
        "deterministic": true,
        "digest": "a1392b9402cdb7b27a7725bee72ffd9e8e82f34418f4715223492a4329686820",
        "energy_joules": 454.80420834975473,
        "episode_passed": true,
        "falls": 0,
        "peak_torque_nm": 94.2484429378286,
        "progress_meters": -0.757331789726074,
        "reason": "complete",
        "repeat_digest": "a1392b9402cdb7b27a7725bee72ffd9e8e82f34418f4715223492a4329686820",
        "reset_perturbation": {
          "base_xy_m": [
            -0.0009535514630027344,
            -0.0008060354263435068
          ],
          "base_yaw_rad": 0.003142257405942803,
          "joint_position_rad": [
            -0.0016323362314596124,
            0.000400402103862616,
            0.0009142421072471785,
            -0.0012483957065335862,
            -0.0017794134906677272,
            -0.0009001225283758476,
            0.0006297320595023703,
            0.000249062651121712,
            -0.0013997509467786556,
            -0.0002694768367808513
          ]
        },
        "seed": 2,
        "status": "PASS",
        "time_seconds": 10.000000000000009
      },
      {
        "collisions": null,
        "course": "BASIC-001@1.0.0",
        "deterministic": true,
        "digest": "5340dc27093e7a65d84122c1cfdd5e499d9e37f1380e4e337618cdf9e37eaa94",
        "energy_joules": 456.0467679133178,
        "episode_passed": true,
        "falls": 0,
        "peak_torque_nm": 94.37497108520613,
        "progress_meters": -0.757720956672741,
        "reason": "complete",
        "repeat_digest": "5340dc27093e7a65d84122c1cfdd5e499d9e37f1380e4e337618cdf9e37eaa94",
        "reset_perturbation": {
          "base_xy_m": [
            -0.0016574033314255025,
            -0.0010527579736156012
          ],
          "base_yaw_rad": 0.003012744652063969,
          "joint_position_rad": [
            0.00032864814425747116,
            -0.0016234854310384034,
            -0.0002674922390541048,
            -8.37948074366639e-05,
            -0.0013610443414516858,
            0.0009383086056368582,
            -0.0015453119203143863,
            -0.00043508723801735183,
            6.69607304854547e-05,
            -0.0002774879183432888
          ]
        },
        "seed": 3,
        "status": "PASS",
        "time_seconds": 10.000000000000009
      },
      {
        "collisions": null,
        "course": "BASIC-001@1.0.0",
        "deterministic": true,
        "digest": "d088a7230169e43200a6eb5b821dd8093d3889ab23462aa9b6b75c51c97a458c",
        "energy_joules": 455.2136309387777,
        "episode_passed": true,
        "falls": 0,
        "peak_torque_nm": 94.04553115287065,
        "progress_meters": -0.7593859904429123,
        "reason": "complete",
        "repeat_digest": "d088a7230169e43200a6eb5b821dd8093d3889ab23462aa9b6b75c51c97a458c",
        "reset_perturbation": {
          "base_xy_m": [
            0.0017722244222894705,
            4.531021125744639e-05
          ],
          "base_yaw_rad": 0.0047624370570770415,
          "joint_position_rad": [
            -0.0016766559044175914,
            0.0004294233279801185,
            -0.0004940536624909097,
            0.001207604827943229,
            -0.0013018887354238862,
            0.0014865410967506256,
            0.00017576560305399268,
            0.0016088603188639534,
            -9.138590464317487e-05,
            -0.0002780148890823475
          ]
        },
        "seed": 4,
        "status": "PASS",
        "time_seconds": 10.000000000000009
      },
      {
        "collisions": null,
        "course": "BASIC-002@1.0.0",
        "deterministic": true,
        "digest": "2cfcde872283d8b1b71cde0db99c674cfb0e369bf4eab657f1088cf469e8d27e",
        "energy_joules": 897.1635095243406,
        "episode_passed": true,
        "falls": 0,
        "peak_torque_nm": 100.44086859465943,
        "progress_meters": 5.005527188485268,
        "reason": "complete",
        "repeat_digest": "2cfcde872283d8b1b71cde0db99c674cfb0e369bf4eab657f1088cf469e8d27e",
        "reset_perturbation": {
          "base_xy_m": [
            0.0005478467492858173,
            -0.0009208531449445187
          ],
          "base_yaw_rad": -0.0045902647606380536,
          "joint_position_rad": [
            -0.0019338894578858836,
            0.0012530809568010897,
            0.0016510223091108869,
            0.00042654310306871945,
            0.0009179862439359937,
            0.0001744999658616915,
            0.0017402896951510729,
            0.0012634142164861287,
            -0.0019890459993194077,
            0.0014296171063502773
          ]
        },
        "seed": 0,
        "status": "PASS",
        "time_seconds": 12.240000000000757
      },
      {
        "collisions": null,
        "course": "BASIC-002@1.0.0",
        "deterministic": true,
        "digest": "2f965debf27ac67d7a551e0fb165c90ccfabe00302692ca7b94503cb34a3f974",
        "energy_joules": 891.8011542455876,
        "episode_passed": true,
        "falls": 0,
        "peak_torque_nm": 99.4245612127866,
        "progress_meters": 5.003868996883608,
        "reason": "complete",
        "repeat_digest": "2f965debf27ac67d7a551e0fb165c90ccfabe00302692ca7b94503cb34a3f974",
        "reset_perturbation": {
          "base_xy_m": [
            4.7286498801026864e-05,
            0.0018018547853037412
          ],
          "base_yaw_rad": -0.0035584038728036626,
          "joint_position_rad": [
            0.0017945977885489755,
            -0.0007526741919580582,
            -0.0003066942041096974,
            0.001310810375281767,
            -0.0003632034545233549,
            0.000198374750692238,
            -0.0018897635470277265,
            0.0010140524346992264,
            0.0001525732528771129,
            -0.0006810731340036314
          ]
        },
        "seed": 1,
        "status": "PASS",
        "time_seconds": 12.240000000000757
      },
      {
        "collisions": null,
        "course": "BASIC-002@1.0.0",
        "deterministic": true,
        "digest": "ff6f97fad3e812de20efe26e8a68b8ccecd67b9a42b988c854491579c4b69d45",
        "energy_joules": 896.023959977105,
        "episode_passed": true,
        "falls": 0,
        "peak_torque_nm": 100.75062690725906,
        "progress_meters": 5.000365938951017,
        "reason": "complete",
        "repeat_digest": "ff6f97fad3e812de20efe26e8a68b8ccecd67b9a42b988c854491579c4b69d45",
        "reset_perturbation": {
          "base_xy_m": [
            -0.0009535514630027344,